question,option_a,option_b,option_c,option_d,correct_answer,explanation,difficulty,points
What is 2+2?,3,4,5,6,B,Addition of two numbers,easy,1
What is the capital of France?,London,Berlin,Paris,Madrid,C,Paris is the capital city of France,medium,1
Which planet is closest to the Sun?,Venus,Mercury,Earth,Mars,B,Mercury is the closest planet to the Sun,medium,1
What is the largest ocean on Earth?,Atlantic,Indian,Arctic,Pacific,D,The Pacific Ocean is the largest ocean,easy,1
Who wrote Romeo and Juliet?,Charles Dickens,William Shakespeare,Jane Austen,Mark Twain,B,William Shakespeare wrote Romeo and Juliet,medium,2